content,score,at,sentiment_predicted
ga jelas sinyal aman ga bisa pesan tiket liat jadwal tiket ja ga bisa juga ga jelasss kaaaiiii,1,2026-03-22 22:21:28,negative
loadingnya terlalu lama trus pas cari tiket katanya tiket habis dicoba lagi tiba tiket tersedia trus pas ambil tiket pulang gitu lagi ribet banget pesan tiket doang dr semalaman ga bisa,2,2026-03-22 22:21:00,negative
aplikasi kalau pas high season kok selalu server down perbaiki lah,1,2026-03-22 22:07:18,negative
aplikasi ini bagus banget tapi kenapa suka ngelegg sampe balik lagi dan bahkan gabisa pesan sekaligus lebih dari satu orang mohon betulkan min,4,2026-03-22 21:54:00,positive
aplikasi tolol,1,2026-03-22 21:52:09,negative
ketika lebaran begini aplikasi down jadwal kereta tidak muncul transaksi qris sukses tapi gagal di merchant access by kai tiket terbooking jadi hangus harusnya tim it jangan libur to soalnya terlalu lambat penanganannya,1,2026-03-22 21:22:27,positive
cari jadwal kereta sekarang kok susah banget ya,1,2026-03-22 21:10:14,positive
gak jelas nih apk selalu gak ada jadwal tersedia,1,2026-03-22 20:52:38,negative
log out sendiri pesan tiket tidak bisa hadeh,1,2026-03-22 20:52:23,negative
tidak bisa di buka,1,2026-03-22 20:50:34,negative
aplikasi sering error,1,2026-03-22 20:23:15,negative
kai sekarang jelek banget pas mau pesan tiket loading nya lama banget udaa lama ntar malah katanya tidak ada tiket yg tersedia utk keberangkatan ini padahal mau nambah penumpang lagi di awal pesan bisa mau pesan lagi malah gini terus padahal dulu ngga gini saya sudah sering naik kereta api ngga pernah gini sekarang ntah kenapa malah gini mohon di perbaiki min,1,2026-03-22 20:22:33,negative
bagus,4,2026-03-22 20:21:15,positive
pembatal mudah cepat dan aman terimakasih kai,5,2026-03-22 19:55:48,positive
sekarang versi baru lemot masa minggu g bisa di buka,1,2026-03-22 19:52:28,negative
aplikasi sering error tidak muncul jadwal kereta,1,2026-03-22 19:41:47,negative
tiket nya kemahalan kembalikan pso,1,2026-03-22 18:51:44,negative
ok,5,2026-03-22 18:17:46,negative
parah banget harganya x lipat naiknya padahal lebaran lebih hari parah kai udah ambil untung banyak kereta pun sulit,1,2026-03-22 18:12:18,negative
aplikasi kurang profesional di danai angaran dananrtara aplikasi overload karna banyak antrian konyol kalah dengan aplikasi sebelah traveloka ganti aja humas it kai acces d kantor pusat bussinesnya,1,2026-03-22 18:07:53,negative
sumpah yang bikin nih aplikasi ga profesional lemot banget loading nya padahal internet aman aman aja kalau dipake ke aplikasi lain,1,2026-03-22 18:04:36,negative
layanan aplikasi buruk sekali,1,2026-03-22 17:49:40,negative
kenapa ga bisa di pakai selalu masa pemeliharaan aplikasi kai acces aku mau pesan malah eror data hilang tbtb,1,2026-03-22 17:42:41,negative
pembayaran sulit loadiiing,1,2026-03-22 17:34:27,negative
kenapa dana pembatalan tiket gak bisa di kirim ke ewalet bikin susah yang gak punya rekening,1,2026-03-22 17:32:16,negative
lemott,2,2026-03-22 17:09:03,negative
aplikasi sering error,1,2026-03-22 16:57:53,negative
kadang suka erorrr perbaiki lagi ya,4,2026-03-22 16:52:08,positive
asli ini versi paling buruk sangat menggangu karena server lemot parah sistem antre ok lah tapi kalo pada akhirnya dapat antrian ngisi malah error ga muncul semua list nya bahkan list habis tiketnya aja ga ada berarti memang error parah gilak sih ini transisi paling jelek udah coba sabar eh pas lihat jam literally jam bolak balik aplikasi nyobain segala kemungkinan buat dapat tiketnya aelah wasting time bet,1,2026-03-22 16:41:17,negative
aplikasi cacat cek harga tiket kereta api lokal aja gak bisa aplikasi macam apa ini,1,2026-03-22 16:32:34,negative
sering error gajelas ni apk,1,2026-03-22 16:19:06,negative
sistem antriannya tolong diperbaiki saat banyak yang akses disuruh nunggu mnt masih oke setelah menit ke ditambah lagi mnt saat udh mnt ternyata jadwal yang diincar tidak ada rute padahal hari biasanya ada rute kereta walau tiket udh habis terjual aku cek rute lain antri lagi dan setelah menit tidak ada rute,1,2026-03-22 15:08:11,negative
bro kai tuh milik pemerintah ko lemot bat apknya alesannya sedang dalam antrian emang ga ada budget pemeliharaan apk atau web aneh banget masa iya kalah sama aplikasi game,4,2026-03-22 15:04:52,negative
aplikasi sering down hari pemeliharaan mulu,1,2026-03-22 14:57:21,negative
baik,4,2026-03-22 14:42:37,positive
apliksi sering eror,1,2026-03-22 14:42:07,positive
saya daftar jadi member basic ga bisa bisa,1,2026-03-22 14:35:09,negative
tolong aja saya mau pulang ke jakarta sistem nya down gak bisa pesen jadi nya saya harus di booking id,4,2026-03-22 14:23:22,positive
krnapa sekarang buka aplikasi langsung antrian menit padahal posisi g lagi rame pada nyari tiket kenapa makin ribet sekarang erorkah hari ini kai acces mau lihat tiket saja tidak bisa sampai tgl april,1,2026-03-22 14:11:40,negative
memudahkan utk pembelian tiket,5,2026-03-22 13:42:21,positive
lemot banget woy sinyal padahal bagus hp gak lag,2,2026-03-22 13:31:52,negative
suka trobel,1,2026-03-22 13:30:08,positive
server down terus bukannya mempermudah malah mempersulit udah gonta ganti wifi sama data seluler sama aja,1,2026-03-22 13:29:32,negative
fitur pembatalan tiketnya ribet kadang sering gajelas gitu semoga bisa lebih baik lagi kai,2,2026-03-22 13:24:01,positive
mudah,5,2026-03-22 13:06:48,positive
lelet lelet,2,2026-03-22 13:04:51,negative
aplikasi g bisa dipakai semua kereta kosong padahal sudah cek sampai dengan tanggal bukan tanggal liburan panjang paraaaaaah,1,2026-03-22 12:48:00,negative
aman dan nyaman,5,2026-03-22 12:47:39,positive
sebenarnya aplikasi nya bagus tetapi untuk refresh antrian nya tolong banget wktunya diperhatikan kalau memang akan di upgrade harusnya lebih awal jadi ketika kita mau pesan tiket gak sesusah ini erorr nya kebangetan kalo lgi hari besar,4,2026-03-22 12:43:23,negative
good job,5,2026-03-22 12:41:58,positive
tolong aplikasinya di perbaiki lagi dari tadi saya mau pesen tiket gak bisa terus jadwal kereta gak keluar,4,2026-03-22 12:39:47,negative
server down,2,2026-03-22 12:37:10,positive
aplikasinya suka errorz suruh nunggu menit tapi sejam ditungguin tetep gabisa pesen tiket harusnya udah antisipasi musim mudik banyak orang buka kai access mana pengembalian tiket cuman lagi udahlah tiketnya mahal dasar kai kapitalis,1,2026-03-22 12:35:14,positive
ini kok aplikasinya eror g bisa di buka,1,2026-03-22 12:30:53,negative
aplikasi yng sekarang banyak bug nya lemot,1,2026-03-22 12:13:16,negative
sangat membantu,5,2026-03-22 12:06:34,positive
sangat baik pelayanannya,5,2026-03-22 11:52:20,positive
setelah di update aplikasi eror,2,2026-03-22 11:48:18,positive
apk gak jelas gak bisa menambahkan tiket untuk refund malah di suruh ke loket padahal saya udah yakin pasti telat makanya mau refund tiket,1,2026-03-22 11:48:14,negative
untuk fitur fitur apk nya sangat lengkap tapi kekurangan nya pas saya make itu suka nge bug pas pencarian jadwal kereta pas saya cari jadwal ada trus pas saya kembali cari lagi eh malah ilang jadwalnya trus ada lagi kaya mengganggu banget dan menghambat banget pas mau buru buru beli tiket dan saya sudah sampe kehabisan tiket kereta karena hal tersebut,5,2026-03-22 11:40:10,negative
parah banget min kai transaksi berhasil tiket ga dapet error mulu ni apk padahal di riwayat transaksi saya berhasil tapi di apk malah blum lunas kocak,1,2026-03-22 11:37:18,negative
sering error masa pas pesen klik tgl tidak tersedia klik tgl tersedia klik lagi tgl tersedia loading lama perbaikan lah apalah error aja ini apk masa kalah sma apk yg bukan official kya travelloka dll mohon d perbaiki apk official masa kaya gini gedek bgt,1,2026-03-22 11:33:40,negative
aplikasi g berguna mungkin kai kebanyakan utang aplikasi loding terus g bisa di proses,1,2026-03-22 11:25:23,positive
ok,5,2026-03-22 11:06:05,negative
apknya lemot bet,2,2026-03-22 11:04:13,negative
apaan mau lihat jadwal yg tersedia malah anda dalam antrian halaman ini akan di refresh otomatis nama app kai access tapi kok susah aksesnya,1,2026-03-22 10:56:33,negative
jelek connecting train terus,1,2026-03-22 10:52:08,negative
bagus cuma di jam jam libur lebaran mungkin karena banyak yang akses jadi loading aplikasinya lama banget kadang bisa kadang harus mulai ulang juga,5,2026-03-22 10:08:32,negative
eror bgt ga asik,1,2026-03-22 10:06:18,negative
setelah di perbarui malah ngebug ayolah dinaikkan lagi tingkat kelancaran apk nya,1,2026-03-22 10:04:54,negative
bug nya d perbaiki,5,2026-03-22 09:42:20,negative
apk nya lemot bangettt,1,2026-03-22 09:35:38,negative
ini gimana sekarang kok makin banyak kendala sih mau liat jabwal gak bisa ya buat kereta lokal,5,2026-03-22 09:26:22,negative
mendekati hari lebaran server kok tambah down bukannya di perbaiki dati jauh hari karna pasti banyak yang akses,1,2026-03-22 09:22:50,negative
setelah sekian lama pakai kai acces baru tahun ini kecewa apa memang rata rata kalo aplikasi bukan milik swasta selalu bermasalah cari kereta lokal aja tidak muncul masuk ke antar kota tambah lagi cuma searching update juga sudah wah menyusahkan saja,1,2026-03-22 09:18:34,negative
lelet bat monyett udah pake wifi tetap lelet pake data pun lelett,2,2026-03-22 09:16:11,negative
aplikasinya sangat membantu pertama kali naik kereta api indonesia pelayanan sangat baik,5,2026-03-22 09:02:29,positive
susah banget pemilihan jadwal kereta lama munculnya sudah ditunggu lama malah kosong gak terdetek pas sudah pilih jadwal malah muter muter saja belum pilih kursi,1,2026-03-22 08:34:28,negative
lag anj,1,2026-03-22 08:31:18,negative
aplikasi kok makin sering gangguan sekarang,1,2026-03-22 08:20:11,positive
pesan tiket aja ngelagnya minta ampun masuk aplikasi gak bisa mulu booking tiket pun gak bisa tiba tiba udah ditempatin orang sistem aplikasi indonesia memang sangat buruk sekali,1,2026-03-22 08:19:22,negative
sering eror,1,2026-03-22 08:15:31,positive
toppppppppbgt krenmnn,5,2026-03-22 08:15:08,negative
bagus,5,2026-03-22 07:59:13,positive
aplikasi bikin kesel cek jadwal aja ga bisa mohon segera di perbarui,1,2026-03-22 07:53:33,negative
aplikasi lemot bangetttt kek siput,1,2026-03-22 07:50:58,negative
ga bisa acces sialan ini kai,1,2026-03-22 07:39:15,negative
lelet cuma beli tiket doang banyak ganggu,1,2026-03-22 07:35:16,negative
lemot banget parah,1,2026-03-22 07:29:29,negative
sekarang kai buruk sekali tiket hanya bisa pesan selalu bermasalah sangat buruk biasanya sekali tekan langsung keluar hasilnya sekarang banyak bgt gayanya,1,2026-03-22 07:18:41,negative
mudah dan cepat,5,2026-03-22 07:09:59,positive
minnn kok ini kalo pesen tiket gabisa sih min malah ga muncul jdwalnyaa mohon bantuannya biar mempermudah pesen tiket,2,2026-03-22 07:09:54,positive
apk kaya apa ini susah sekali buat pesan tiket aja susah padahal sinyal bagus,1,2026-03-22 07:08:52,negative
aplikasinya bagus tapi di bagian pembayaran nya terbatas tolong di tambah pembayaran lagi terima kasih,5,2026-03-22 06:41:25,positive
makin ampas gini ye,1,2026-03-22 06:35:31,negative
hari ini mau pesan tiket jadwal tidak tersedia terus padahal sudah di refresh terus hampir jam aplikasi tidak bisa di gunakan,5,2026-03-22 06:02:31,negative
goog job kai,5,2026-03-22 05:58:49,positive
,5,2026-03-22 05:43:18,negative
buruk sekali sekarang mau lihat jadwal kereta aja loading terus menerus dan akhirnya muncul tidak ada jadwal atau tidak ada keberangkatan setelah saya hapus data dan kembali melihat jadwal baru tersedia muncul tolong diperbaiki kenyamanan aplikasinya jujur mulai memburuk setiap update,1,2026-03-22 05:42:23,negative
buka kai acces dari jam sebelom boarding malah gabisa error terus tiba e boarding pass berubah jadi jam sebelum keberangkatan baru bisa dicetak itupun ga keluar nama penumpangnya yg mau dicetak e boarding passnya biasanya jam sebelum keberangkatan udah bisa loh udah dm ig kai ga ada tanggapan padahal lg buru ngejar kereta biar ga ketinggalan giliran pesan tiket suruh buru giliran udah hari h nya gaberfungsi baru kali ini kecewa sm kai,1,2026-03-22 05:29:32,negative
baik,4,2026-03-22 04:39:24,positive
minta tolong securitynya sering ngecek dikereta pramek banyak ibu ibu yg membawa bayi tidak dapat tempat duduk tolong diperhatikan soalnya banyak laki laki yg tidak mau mengalah,5,2026-03-22 04:22:48,negative
siiip mempermudah transaksi,5,2026-03-22 03:16:52,positive
kenapa sya buka gk bisa,5,2026-03-22 02:49:05,negative
terbaik pokoknya mah,5,2026-03-22 01:51:53,positive
baik,4,2026-03-22 01:49:56,positive
mantap,5,2026-03-22 01:18:25,positive
sangat membantu,5,2026-03-22 00:59:10,positive
aplikasi yang sangat mudah membantu untuk memesan tiket kereta,5,2026-03-21 23:29:13,positive
perbaiki bug nya ketersediaan tiket tidak konsisten stabil sebelumnya dicek ada beberapa saat kemudian tidak ada setelah restart muncul lagi ketersediaannya tapi waktu back menu sebelumnya terus cek lagi hilang lagi,1,2026-03-21 22:10:55,positive
yg bener aja ga bisa booking tiket per misalkan saya mesen tiket tpi tujuan sama dan per untuk di bagikan ke yg lain,2,2026-03-21 21:29:24,negative
sumpah gedeg dan kezelll bgtt masa mau pesen tiket waktu jam selalu ada gangguan error jadinya kan aku kehabisan tiket trs kalau begitu caranya dan ga hanya aku yg mengalami hal yg sama bahkan temen juga terus ya masa aku dah bayar tiketnya tiba ga ada notif pembayaran dan tiket ku blm terbayar pdhl kan udh masa transportasi elit aplikasi sulit udh rela begadang demi war tiket ujung nya jg tetep kehabisan tiket hdeuhhh mending aplikasi apus aja ga guna tau ga,2,2026-03-21 18:40:44,negative
kalo lagi war tengah malem tu jangan eror trus tiba tiba udah penuh aja emosi bgtt kalo banyak yang kritik tu diperbaiki banyak yang mengalami kejadian sama aku war tiket sampe jam lebih tapi tetep ga dapet tiket,1,2026-03-21 18:03:11,negative
kyk telek,1,2026-03-21 17:47:22,negative
kecewa dengan pihak kai penyediaan tiket yg gk masuk akal mau naik kereta dari kotabumi ke tanjung karang saja susah bangett pada hal sudah pesen dari jam masih aja gk dapet,2,2026-03-21 17:45:42,negative
aplikasinya bagus tapi tolong lebih d tingkatkat masalah koneksi apalagi klo jam jam awal selalu susah buat masuk k pembayaran,5,2026-03-21 17:34:30,negative
servermu belum siap buat war tiket mengecewakan,1,2026-03-21 17:33:18,negative
aplikasi sampah sesampah sampahnya kalo belum siap online gausah sok sokan online server gak respon tiap mau beli error terus wifi bagus tapi tetep gabisa mending pensiun aja,1,2026-03-21 17:32:21,negative
tolong untuk jam malam server tolong diperbaiki sering lemot dan kadang gak keluar jadwal keretanya,1,2026-03-21 17:32:06,negative
jelek banget server sering error tolong diperbaiki,1,2026-03-21 17:29:58,negative
tolong dong masalah eror ni udaa tahun kek gini terus masa udaa dapet tiket malah gabisa ke tahap selanjutnya padahal tiket masi tersedia dan saat pemesanan selalu saja eror mulu ni aplikasi mau di jadwal sibuk maupun jadwal yang ga sibuk udaa tahun kek gini terus terutama di daerah sumatra,1,2026-03-21 17:29:00,negative
bagus cm disaat sudah mau pesan itu gimana slalu slow respon trs sampai kehabisan,4,2026-03-21 17:21:51,negative
harusnya aplikasi ini tidak cocok untuk mendapatkan bintang meskipun hanya saya sudah tidak bisa lagi menggunakannya login tidak bisa lemot sekali dan tiba tiba selalu failed data kalau update harus nya menjadi lebih baik dan efisien bukan makin buruk dan mempersulit,1,2026-03-21 17:21:17,negative
bagus lebih cepatm tapi membutuhkan internet nya untuk war tiket tolong di perbaiki lagi mungkin sedikit lebih bisa di stabilkan karena internet saya sudah full dn memakai kartu indo sat tetap tidka bisa membeli tiket loading nya juga sangat lama,5,2026-03-21 17:19:57,negative
server kebanyakan error mohon untuk segera diperbaiki,4,2026-03-21 17:17:16,positive
kenapa ya apk saya selalu eror ga seperti sebelumnya,1,2026-03-21 17:16:21,negative
perbaiki dulu pembelian tiket di saat pergantian hari server selalu penuh,1,2026-03-21 17:13:23,negative
baru jam dah habis ludes mau ke balam banyak banget calo tiket kayaknya,1,2026-03-21 17:10:39,negative
tolong servernya diperluas diperbaiki,1,2026-03-21 17:06:53,negative
server gampang down mau batalkan pesanan ga bisa,1,2026-03-21 17:04:39,negative
bagus sih tapi kenapa harus ada member basic yg gk bisa diakses buat persulit penguna,1,2026-03-21 16:46:55,negative
saya kasi bintang krna apk ny mnurut saya jelek bgt masa cuma antar kota aja nyari stasiun nya sampe berjam tetap gk ketemu dimasukin nama kota juga enggk ada padahal dari stasiun medan atau bandar khalifah ke stasiun perlanaan simalungun sampe searching ke google bolak balek eh tetiba pas di cek lagi muncul itu stasiun nya dan jadwalnya trus pas mau cek lagi malah gk muncul semua jadwalnya subhanallah banget bobroknya apk ini aneh tolong perbaiki dong,1,2026-03-21 16:15:58,negative
hayoh we loginnnn,2,2026-03-21 16:01:46,negative
sangat membantu utk pemesanan tiket kai,5,2026-03-21 14:48:59,positive
lebih ditingkatkan demi kebaikan,4,2026-03-21 13:49:15,positive
mantap sat set semua menjadi mudah dg kqi access,5,2026-03-21 13:47:29,positive
loading sampe ketinggalan,1,2026-03-21 12:13:07,negative
setelah update jadi full loading bagus sebelum update,1,2026-03-21 11:55:29,positive
sangat memuaskan,5,2026-03-21 10:58:44,positive
mantab,5,2026-03-21 10:34:19,positive
nice so,5,2026-03-21 10:27:01,positive
susah amat dapet tiketnya,2,2026-03-21 10:15:56,negative
sekarang kok tiap mau lihat jadwal kereta sering tidak bisa ya,5,2026-03-21 08:54:41,negative
sejak update app untuk lebaran app sering banget nge bug error g mau tampilin jadwal jadi g bisa mantau buat cari tiket sm cs dimnta logout dn login lagi tp cm kebatas x dalam satu jam downgrade ini,1,2026-03-21 08:18:40,negative
gagal terus daftar akun basic,1,2026-03-21 07:21:17,negative
puas,5,2026-03-21 06:50:11,positive
selalu memudahkan segala layanan,5,2026-03-21 06:25:08,positive
siang ini bertepatan dengan h lebaran saya beserta ibu saya yang berusia tahun kakak yang berusia tahun menggunakan kereta api dari stasiun madiun ke stasiun solo balapan ibu saya menggunakan kursi roda membutuhkan bantuan untuk naik ke gerbong para petugas kai di stasiun madiun maupun solo balapan stand by dengan sigap membantu kami sehingga perjalanan menjadi lebih mudah menyenangkan terima kasih banyak kepada pt kai semua petugas untuk pelayanan yang excellent,5,2026-03-21 05:37:25,positive
auruh upgrade member pas masukin otp error aneh g mau di beli apa gmn,1,2026-03-21 04:47:39,negative
bagus pelayanannya,4,2026-03-21 04:44:38,positive
eror trus kalo lgi rebutannnnn gilaaa,1,2026-03-21 03:51:38,negative
goood,5,2026-03-21 03:51:37,negative
good,5,2026-03-21 03:04:06,positive
baik,5,2026-03-21 03:01:57,positive
tepat,5,2026-03-21 01:19:08,positive
mantap,5,2026-03-21 00:49:44,positive
untuk penjualan tiketnya aneh masa mau beli tiket sebulan kedepan udah ngga ada tapi giliran udah beberapa hari lagi ada tapi cuma sedikit padahal saya mau beli sekeluarga untuk ketersediaan tiketnya untuk lebih transparan lagi,1,2026-03-20 21:07:14,negative
gatau kenapa kai access saya setiap ngecek tiket di aplikasi selalu ga muncul padahal di web booking kai id bisa bisa aja apk rusakkkk,1,2026-03-20 20:31:07,negative
daftar basic udah kirim otp gagal mulu kai sampah,1,2026-03-20 19:31:02,negative
sangat terbantu sekali aplikasi mantab,5,2026-03-20 19:18:22,positive
kerennnnn banget aplikasinya user friendly mesen atau refund mudah bangettt,5,2026-03-20 18:48:41,positive
sangat disayangkan terdapat bug pada sistem yang mengakibatkan tidak adanya update tiket secara real time tidak tertulis apakah terdapat seat atau tidak dan ketika ingin mencoba keluar langsung terhitung memesan tiket dengan tagihan sehingga tidak dapat melakukan pembayaran dan tidak dapat membatalkan pesanan tolong segera diperbaiki terimakasih,1,2026-03-20 17:32:28,positive
kenapa sih kok selalu sulit bgt pesennya pas hari raya,2,2026-03-20 17:19:28,negative
war tiket wib dibuka wib udah ga bisa lagi mesen seluruh tiket abis luar biasa orang kaya ga masukin data lagi mau mesen,1,2026-03-20 17:19:22,negative
aplikasi swring teobel ga jelas,2,2026-03-20 17:14:45,negative
tidak bisa di akses,5,2026-03-20 16:46:23,negative
cukup membantu,5,2026-03-20 15:46:06,positive
good,4,2026-03-20 14:26:27,positive
dari tadi mau login gabisa bisa gila kali,1,2026-03-20 14:00:36,negative
mantap,5,2026-03-20 12:39:44,positive
aplikasi tolol,1,2026-03-20 12:26:44,negative
kadang tiker tersedia kadang engga,4,2026-03-20 11:53:21,positive
keren,5,2026-03-20 11:43:36,positive
masa gak bisa tiket ka lokal untuk orang kalo suami istri dah orang sama anak atau gimana aneh aja di saat yg lain membuka pelayanan ini malah batasi pelayanan secara exream,1,2026-03-20 09:03:57,negative
mantap mempermudah pelanggan,5,2026-03-20 09:01:23,positive
bagus,5,2026-03-20 08:30:49,positive
bagus,5,2026-03-20 08:28:07,positive
tolong dong ini saya mau daftar jadi member basicc kaga bisa bisa padahal udh dii isi bener tolong dong udh berapa kali daftar member basiic bacaan nya login dr gmail gada yg masuk ke gmail tolong dong diperbaiki lagi sistem nya,1,2026-03-20 07:21:00,negative
mau melakukan pembayaran aja susah banget dicoba berkali kali ga bisa terus mau dibatalkan ga bisa coba pesan lagi juga ga bisa,1,2026-03-20 05:41:55,negative
praktis,5,2026-03-20 05:31:12,positive
aman,4,2026-03-20 05:22:45,positive
,5,2026-03-20 05:03:54,negative
apk bagus mudah digunakan,5,2026-03-20 04:51:46,positive
jos,5,2026-03-20 04:44:50,positive
sudah dari lama mendaftar begitu mau melengkapi daftar diri dan kode otp sudah saya masukkan kenapa begitu di pencet lanjutkan malah loading lama terus mulai dari awal puasa saya coba sampai sekarang nggak tau sudah berapa kali saya masukkan kode otp tetep aja loading lama terus ini gimana ya saya nggak bisa melengkapin data diri saya,1,2026-03-20 04:22:58,negative
good job,5,2026-03-20 03:50:07,positive
ngisi saldo kaipay tpi gk masuk tolong dibenahi lagi ya,1,2026-03-20 02:58:35,negative
mantap,5,2026-03-20 02:54:47,positive
okey,5,2026-03-20 01:59:11,positive
sangat membantu,5,2026-03-20 01:49:49,positive
bagus,5,2026-03-20 00:01:09,positive
tidak ada peningkatan dari dulu server selalu down terus padahal msi ada seat tapi pas dibeli no seat available apasih,1,2026-03-19 23:55:37,positive
kai bagian publikasi tolong artikelnya diperbaharui jangan makan gaji buta kebanyakan artikelnya sudah tahun lalu semua jangan remehkan masyarakat masyarakat juga banyak yang rajin membaca fungsikan aplikasi kai sebagai sarana untuk berkembang lebih baik lagi semangat dan jangan dipersulit dengan malas,2,2026-03-19 22:30:47,positive
makasih,5,2026-03-19 22:16:23,positive
masa ga ada jadwak kereta yg tersedia perbaikin lah,1,2026-03-19 22:05:51,negative
mantab terimakasih kai sukses selalu kai top,5,2026-03-19 21:10:42,positive
aplikasi yang sangat membantu tapi keseringan minta update,5,2026-03-19 18:46:31,positive
kenapa kreta airlangga untuk booking maret di up nya jam,4,2026-03-19 18:22:44,negative
mantap,5,2026-03-19 17:57:36,positive
plis ka di mudahkan lah pembatalan tiketnya makasih,5,2026-03-19 17:52:08,positive
tiket kotabumi blm menit langung sold out hebat bangget,1,2026-03-19 17:41:47,negative
aplikasi yang sangat buruk masa cuma satu kesalahan memasukkan kata sandi akun di lock satu jam apa an ini aplikasi sampah,1,2026-03-19 16:20:47,negative
so far so good,5,2026-03-19 14:31:55,positive
sgt bagus,5,2026-03-19 13:50:31,positive
aplikasi gg,1,2026-03-19 13:44:33,negative
mudah dan simpel,5,2026-03-19 13:13:03,positive
mudik allhamdulilah,5,2026-03-19 11:44:48,positive
saya sudah beli tiket saldo pun sudah kepotong pas cek di menu tiket saya kok belum ada tiket yang tersimpan padahal saldo saya sudah kepotong dan ketika mau cek tiket juga loading lama,2,2026-03-19 10:28:25,negative
sdh baik akan tetapi harus tetap mencari improvment yg baik lagi atas layanan ke konsumen,5,2026-03-19 09:23:12,positive
respon sangat baik,5,2026-03-19 08:29:01,positive
rute sering hilang tidak ada jadwal muncul,2,2026-03-19 05:43:50,negative
oke,5,2026-03-19 04:44:53,positive
ok,5,2026-03-19 04:04:07,negative
sangat mudah tak perlu antri,5,2026-03-19 02:54:14,positive
kualanamu ke medan jm medan ke binjai kok gk jm lewat sih dari medan ke binjai kan gini gk bisa pulang untuk jdwal tgl maret tolong update dong min kno mdn mdn ke binjai,4,2026-03-19 02:36:43,negative
admin nya ga ngotak cuy,1,2026-03-19 02:10:12,negative
pesen tiket kok malah loading parahhhhh dari dulu penyakitnya sama gak pernah lebih baik,1,2026-03-19 01:58:20,negative
good,5,2026-03-19 01:56:14,positive
membantu sekali,5,2026-03-19 01:31:06,positive
pesan tiket sangat mudah dengan menggunakan aplikasi acces by kai,5,2026-03-19 01:00:32,positive
sangat memudahkan best for kai,5,2026-03-19 00:13:11,positive
good,5,2026-03-18 23:56:11,positive
service ok,4,2026-03-18 23:50:39,positive
goood,5,2026-03-18 23:42:14,negative
pembayaran lewat shopeepay aneh seperti bug kali kaya gini apk aneh,1,2026-03-18 21:24:36,negative
sering eror mohon di perbaiki,1,2026-03-18 20:58:29,positive
cepat dlm pemesanan tiket sangat membantu,5,2026-03-18 20:20:46,positive
sering eror ya tinggal bayar tiba tiba keluar sendiri trs dialihkan ke tulisan selesaikan pembayaran tapi ga bisa dipencet jadi bayarnya lewat mana mau dibatalin ga bisa harus nunggu sisa waktu bayar habis sekalinya nunggu tiket kereta lokalnya udh habis emg harus diperbaiki lagi sistemnya ini apalagi pembayaran yg lewat ovo shopeepay sering keluar sendiri,1,2026-03-18 17:54:39,negative
kalo sering dibuka cek jadwal kereta luar kota tiba jadwal ga ada lgi untuk semua tgl,2,2026-03-18 17:44:21,negative
nyusahin banget kalo misal pesennya sekarang maksimal yaaaa minimal gak usah dipisah tempat duduknya stresss bgt sistem masa lebaran ini,1,2026-03-18 17:42:58,negative
gak jelas apk banyak pembaruan yang justru bikin ribet,1,2026-03-18 17:17:09,negative
